{
  "schema_version": 1,
  "name": "universal-project-governance",
  "version": "3.0.0-rc.20",
  "architecture": "compiled-governance",
  "principles": [
    "ONE_SEMANTIC_RULE_ONE_CANONICAL_DEFINITION",
    "CAPABILITY_GROWTH_MUST_NOT_LINEARLY_INCREASE_RUNTIME_LOAD",
    "COMPLEXITY_BELONGS_IN_COMPILER_NOT_AGENT_CONTEXT",
    "NON_TRIVIAL_CHANGE_PREFERS_STRUCTURAL_INTEGRATION_OVER_PATCH_STACKING",
    "STRUCTURAL_INTEGRATION_IS_TASK_BOUNDED_NOT_SCOPE_EXPANSION",
    "CONTINUITY_MUST_BE_RECONSTRUCTABLE_AFTER_UNPLANNED_INTERRUPTION",
    "LEGACY_PROJECT_ADOPTION_MUST_BE_IN_PLACE_AND_NON_DESTRUCTIVE"
  ],
  "hot_path": [
    {
      "id": "ONE_CURRENT_TRUTH",
      "statement": "Reuse one canonical source of truth; update or remove obsolete normative state instead of creating parallel truth."
    },
    {
      "id": "PROPORTIONAL_CLEANUP",
      "statement": "Every project change gets cleanup proportional to its affected neighborhood; remove replaced, duplicate, temporary, or stale residue when safe."
    },
    {
      "id": "EVIDENCE_BEFORE_CLAIM",
      "statement": "Deletion, migration, compatibility, validation, and debt/completion claims require evidence appropriate to the claim."
    },
    {
      "id": "NO_FABRICATION",
      "statement": "Unknown facts stay unknown; never invent history, timestamps, ownership, rationale, validation, deployment state, or consumer intent."
    },
    {
      "id": "NO_UNMANAGED_DEBT",
      "statement": "Safely fixable in-scope debt is fixed; externally blocked debt becomes a bounded exception with risk and removal/review condition."
    },
    {
      "id": "VALIDATE_AFFECTED",
      "statement": "Run the smallest sufficient checks that establish the affected behavior, cleanup, truth, and contract claims."
    },
    {
      "id": "HANDOFF_IF_UNFINISHED",
      "statement": "If work crosses an agent/session boundary or remains unfinished, persist current handoff state when possible; if interruption prevented handoff, the next actor reconstructs from project truth and observable work state without inventing intent."
    },
    {
      "id": "STRUCTURAL_INTEGRATION",
      "statement": "Except for truly local low-risk edits, integrate at the smallest responsible canonical layer and remove superseded patch paths; structural mode never authorizes unrelated redesign, API change, migration, or cleanup outside task scope."
    }
  ],
  "execution_guidance": [
    {
      "id": "decision_relevance",
      "policy_ids": [
        "TRUTH_CURRENT"
      ],
      "statement": "Keep only information current readers need for project use/maintenance/validation/takeover. Use the user's language; fit wording/format to task/readers. Deliver relevant outcomes/evidence/gaps once, with needed technical detail and why/when. Omit governance/process recitals; put task-rule explanations in project content only if project understanding needs them. No mechanical style rules or extra model polishing calls."
    },
    {
      "id": "complete_change",
      "policy_ids": [
        "STRUCTURAL_INTEGRATION"
      ],
      "statement": "Keep contracts/safety/error handling; resolve affected consumers/tests and obsolete paths. Use current bytes/revisions and the tool's edit semantics; a fragment cannot replace a whole file. Change edge/error returns/exceptions only for the authorized goal. Minimize needless work, not diff size; reserve final validation/handoff budget. Priority: user intent; correctness/safety/truth; contracts/structure; maintainability/readability; cost."
    },
    {
      "id": "evidence_fidelity",
      "policy_ids": [
        "EVIDENCE_AFFECTED"
      ],
      "statement": "Check claims against current code, contracts and validation. Preserve identifiers, input domains, numbers, references, negation and unknowns when rewriting/shortening; never present omitted facts or unverified completion as established."
    },
    {
      "id": "task_scoped_reading",
      "policy_ids": [
        "EVIDENCE_AFFECTED"
      ],
      "statement": "Honor required reads; discover existing paths/anchors via indexes or bounded search before batching. Writable paths may be planned additions; listings/links alone are not read obligations. Trace implementations/contracts/consumers/tests; expand for dependencies, failures, stale/conflicting evidence or coverage gaps. Defer unrelated material. Recover interrupted/stale/contradictory state from project evidence. Indexes/labels/read budgets never prove coverage; unknowns stay unknown."
    }
  ],
  "risk_model": {
    "dimensions": {
      "scope": {
        "weight": 1,
        "max": 2
      },
      "reversibility": {
        "weight": 1,
        "max": 2
      },
      "security": {
        "weight": 2,
        "max": 2
      },
      "data": {
        "weight": 2,
        "max": 2
      },
      "external_consumers": {
        "weight": 2,
        "max": 2
      },
      "migration": {
        "weight": 2,
        "max": 2
      },
      "contract_change": {
        "weight": 2,
        "max": 2
      },
      "unknowns": {
        "weight": 1,
        "max": 2
      },
      "handoff": {
        "weight": 1,
        "max": 2
      }
    },
    "levels": [
      {
        "id": "trivial",
        "min": 0,
        "max": 1,
        "report": "none"
      },
      {
        "id": "low",
        "min": 2,
        "max": 3,
        "report": "change-note"
      },
      {
        "id": "medium",
        "min": 4,
        "max": 7,
        "report": "engineering"
      },
      {
        "id": "high",
        "min": 8,
        "max": 99,
        "report": "engineering"
      }
    ],
    "release_operation_forces": "audit"
  },
  "default_rules": [
    "CLEANUP_OBSOLETE",
    "TRUTH_CURRENT",
    "EVIDENCE_AFFECTED"
  ],
  "policies": [
    {
      "id": "CLEANUP_OBSOLETE",
      "kind": "closure",
      "severity": "required",
      "triggers": {
        "operations": [
          "edit",
          "refactor",
          "delete",
          "migration",
          "dependency",
          "generated",
          "architecture",
          "security",
          "data",
          "docs"
        ],
        "domains": [],
        "signals": []
      },
      "requires": [],
      "conflicts_with": [],
      "applies_to": [
        "code",
        "config",
        "data",
        "docs",
        "infra",
        "ml",
        "automation",
        "design"
      ],
      "closure": "Remove or justify replaced, duplicate, obsolete, temporary, generated-drift, stale-doc, and orphaned residue in the affected neighborhood.",
      "evidence": [
        "targeted residue/reference review"
      ],
      "report": "inherit",
      "handoff": "inherit",
      "eval_tags": [
        "cleanup",
        "debt"
      ]
    },
    {
      "id": "TRUTH_CURRENT",
      "kind": "truth",
      "severity": "required",
      "triggers": {
        "operations": [
          "edit",
          "refactor",
          "migration",
          "dependency",
          "generated",
          "architecture",
          "security",
          "data",
          "docs",
          "release"
        ],
        "domains": [],
        "signals": [
          "behavior_change",
          "structure_change",
          "contract_change"
        ]
      },
      "requires": [],
      "conflicts_with": [],
      "applies_to": [
        "code",
        "config",
        "data",
        "docs",
        "infra",
        "ml",
        "automation",
        "design"
      ],
      "closure": "Synchronize existing canonical project documentation/state with what is true now; do not append a second independently editable truth.",
      "evidence": [
        "canonical source-of-truth review"
      ],
      "report": "inherit",
      "handoff": "inherit",
      "eval_tags": [
        "truth",
        "documentation"
      ]
    },
    {
      "id": "EVIDENCE_AFFECTED",
      "kind": "evidence",
      "severity": "blocking",
      "triggers": {
        "operations": [
          "edit",
          "refactor",
          "delete",
          "migration",
          "dependency",
          "generated",
          "architecture",
          "security",
          "data",
          "docs",
          "release"
        ],
        "domains": [],
        "signals": []
      },
      "requires": [],
      "conflicts_with": [],
      "applies_to": [
        "code",
        "config",
        "data",
        "docs",
        "infra",
        "ml",
        "automation",
        "design"
      ],
      "closure": "Validate the actual claims made by the change using the smallest sufficient checks; report any unverified surface explicitly.",
      "evidence": [
        "actual command/procedure and observed result"
      ],
      "report": "inherit",
      "handoff": "inherit",
      "eval_tags": [
        "validation",
        "evidence"
      ]
    },
    {
      "id": "SAFE_DELETE",
      "kind": "evidence",
      "severity": "blocking",
      "triggers": {
        "operations": [
          "delete"
        ],
        "domains": [],
        "signals": [
          "deletion",
          "replacement"
        ]
      },
      "requires": [
        "EVIDENCE_AFFECTED"
      ],
      "conflicts_with": [],
      "applies_to": [
        "code",
        "config",
        "data",
        "docs",
        "infra",
        "ml",
        "automation",
        "design"
      ],
      "closure": "Before destructive removal, verify relevant consumers, runtime/build/test/generation dependencies, migration/rollback needs, and retention obligations.",
      "evidence": [
        "consumer/dependency evidence",
        "retention evidence when applicable",
        "post-delete validation"
      ],
      "report": "inherit",
      "handoff": "inherit",
      "eval_tags": [
        "safe-delete",
        "retention"
      ]
    },
    {
      "id": "CONTRACT_VALIDATE",
      "kind": "evidence",
      "severity": "blocking",
      "triggers": {